claim_id,arrangement_scope,topic,claimed_value,source_files,support_level,repo_backed,machine_readable,promotion_ready,notes
char0_degree_112,"84,84a",char0 singular-locus degree,112,"['COMPUTATION_LOG.md', 'hodgecy_v4_inserts.tex', 'scripts/nodes_q_84.sing', 'scripts/nodes_q_84a.sing', 'outputs/out84.txt', 'outputs/out84a.txt']",repo_backed,True,True,False,"The full package includes Singular scripts and output logs showing dim(cone)=1 and deg=112 for 84 and 84a. This backs the degree claim, but not reducedness or Hessian-rank certification."
reduced_true,"84,84a",reducedness,true,"['COMPUTATION_LOG.md', 'hodgecy_v4_inserts.tex']",log_only,False,False,False,"Reducedness is asserted in prose, but no standalone machine-readable reducedness certificate is present."
hessian_rank_3,"84,84a",Hessian rank,3 at all singular points,"['COMPUTATION_LOG.md', 'hodgecy_v4_inserts.tex']",log_only,False,False,False,"The package contains the nodality claim in prose, but no Hessian rank distribution certificate or per-point rank export."
defect_equals_7,"84,84a",defect,7,"['COMPUTATION_LOG.md', 'hodgecy_v4_inserts.tex', 'rank60.py', 'scripts/defect_p.sing', 'scripts/defect_p2.sing']",partially_backed,False,False,False,"The exact rank-60 lower-bound script and the finite-field Singular scripts are present, but no machine-readable finite-field outputs are bundled, so the equality claim defect=7 is not fully repo-backed."
hilbert_degree_8_equals_105,"84,84a",Hilbert function degree 8,105,"['COMPUTATION_LOG.md', 'hodgecy_v4_inserts.tex', 'scripts/defect_p.sing', 'scripts/defect_p2.sing']",partially_backed,False,False,False,"The finite-field computation scripts are present, but no raw machine-readable outputs for HF(8)=105 are bundled."
genericity_g1_g2,"84,84a",genericity,G1 and G2 pass,['genericity_check.py'],repo_backed,True,False,True,The package includes an executable exact-rational genericity script. Equivalent repo-native verification is already integrated and tested.
rank60_lower_bound,"84,84a",degree-8 rank lower bound,rank 60,['rank60.py'],repo_backed,True,False,True,The package includes the exact rational rank-60 script supporting the lower-bound half of the defect sandwich.
